{"series":[{"values":[12,25,25,34.900001525879,27,35.099998474121,29,null,29,null,null,null,30],"name":"Employee Ownership","seriesDataTypeId":6},{"values":[30,30,30,35,30,35,30,35,30,35,35,35,30],"name":"Target","seriesDataTypeId":6},{"values":[88,75,75,65.1,73,64.9,71,null,71,null,null,null,70],"name":"Outside Investors","seriesDataTypeId":6}],"concept":"scorecard-77146/measures/measure-423495","periodicity":"Quarterly","periods":[{"periodId":149093,"periodDate":"2022-12-31","period":"Dec-22"},{"periodId":168164,"periodDate":"2023-06-30","period":"Jun-23"},{"periodId":168168,"periodDate":"2023-12-31","period":"Dec-23"},{"periodId":168170,"periodDate":"2024-01-31","period":"Jan-24"},{"periodId":168172,"periodDate":"2024-03-31","period":"Mar-24"},{"periodId":149074,"periodDate":"2024-04-30","period":"Apr-24"},{"periodId":189836,"periodDate":"2024-06-30","period":"Jun-24"},{"periodId":189839,"periodDate":"2024-07-31","period":"Jul-24"},{"periodId":189840,"periodDate":"2024-09-30","period":"Sep-24"},{"periodId":189845,"periodDate":"2024-10-31","period":"Oct-24"},{"periodId":189842,"periodDate":"2025-01-31","period":"Jan-25"},{"periodId":168171,"periodDate":"2025-04-30","period":"Apr-25"},{"periodId":189846,"periodDate":"2025-12-31","period":"Dec-25"}]}