{"series":[{"values":[1000,1000,1000,1000,1000,1000,1000,1000,1000,1000,1000,1000,1000,1000],"name":"Budget","seriesDataTypeId":4},{"values":[null,null,null,null,null,null,null,null,null,null,null,null,null,null],"name":"Elapsed Days","seriesDataTypeId":9},{"values":[null,null,null,null,null,null,null,null,null,null,null,null,null,84],"name":"Milestone Percent Complete","seriesDataTypeId":6}],"concept":"scorecard-77147/milestones/milestone-281266","periodicity":"Monthly 2025-26","periods":[{"periodId":168164,"periodDate":"2023-06-30","period":"Jun-23"},{"periodId":168168,"periodDate":"2023-12-31","period":"Dec-23"},{"periodId":168170,"periodDate":"2024-01-31","period":"Jan-24"},{"periodId":168173,"periodDate":"2024-02-29","period":"Feb-24"},{"periodId":168172,"periodDate":"2024-03-31","period":"Mar-24"},{"periodId":149074,"periodDate":"2024-04-30","period":"Apr-24"},{"periodId":189837,"periodDate":"2024-05-31","period":"May-24"},{"periodId":189836,"periodDate":"2024-06-30","period":"Jun-24"},{"periodId":189839,"periodDate":"2024-07-31","period":"Jul-24"},{"periodId":189838,"periodDate":"2024-08-31","period":"Aug-24"},{"periodId":189840,"periodDate":"2024-09-30","period":"Sep-24"},{"periodId":189845,"periodDate":"2024-10-31","period":"Oct-24"},{"periodId":189841,"periodDate":"2024-11-30","period":"Nov-24"},{"periodId":189846,"periodDate":"2025-12-31","period":"Dec-25"}]}