{"series":[{"values":[null,null,null,null,null,2000,2000,2000,2000,2000,2000,2000,2000,2000,2000,2000,2000,2000,2000,null,null,null,null,null,null,null,null,null,null,null,null,null,null,null,null,null,null],"name":"Budget","seriesDataTypeId":4},{"values":[null,null,null,null,null,null,null,null,null,null,null,null,null,null,null,null,2,33,63,94,125,155,186,216,247,278,306,337,367,398,428,459,490,520,551,581,612],"name":"Elapsed Days","seriesDataTypeId":5},{"values":[0,13,15,24,31,34,37,41,44,47,51,53,59,64,78,80,82,85,88,90,90,90,90,90,96,null,null,null,null,null,null,null,null,null,null,null,null],"name":"Milestone Percent Complete","seriesDataTypeId":6}],"concept":"scorecard-7612/milestones/milestone-270087","periodicity":"Monthly","periods":[{"periodId":33171,"periodDate":"2020-06-30","period":"Jun-20"},{"periodId":33178,"periodDate":"2021-01-31","period":"Jan-21"},{"periodId":33179,"periodDate":"2021-02-28","period":"Feb-21"},{"periodId":33180,"periodDate":"2021-03-31","period":"Mar-21"},{"periodId":18799,"periodDate":"2021-04-30","period":"Apr-21"},{"periodId":168152,"periodDate":"2021-05-31","period":"May-21"},{"periodId":168150,"periodDate":"2021-06-30","period":"Jun-21"},{"periodId":168151,"periodDate":"2021-07-31","period":"Jul-21"},{"periodId":168154,"periodDate":"2021-08-31","period":"Aug-21"},{"periodId":168153,"periodDate":"2021-09-30","period":"Sep-21"},{"periodId":168155,"periodDate":"2021-10-31","period":"Oct-21"},{"periodId":168156,"periodDate":"2021-11-30","period":"Nov-21"},{"periodId":168158,"periodDate":"2021-12-31","period":"Dec-21"},{"periodId":168157,"periodDate":"2022-01-31","period":"Jan-22"},{"periodId":168159,"periodDate":"2022-02-28","period":"Feb-22"},{"periodId":168160,"periodDate":"2022-03-31","period":"Mar-22"},{"periodId":18800,"periodDate":"2022-04-30","period":"Apr-22"},{"periodId":192046,"periodDate":"2022-05-31","period":"May-22"},{"periodId":192043,"periodDate":"2022-06-30","period":"Jun-22"},{"periodId":192044,"periodDate":"2022-07-31","period":"Jul-22"},{"periodId":192050,"periodDate":"2022-08-31","period":"Aug-22"},{"periodId":192045,"periodDate":"2022-09-30","period":"Sep-22"},{"periodId":192047,"periodDate":"2022-10-31","period":"Oct-22"},{"periodId":192049,"periodDate":"2022-11-30","period":"Nov-22"},{"periodId":192048,"periodDate":"2022-12-31","period":"Dec-22"},{"periodId":192051,"periodDate":"2023-01-31","period":"Jan-23"},{"periodId":192052,"periodDate":"2023-02-28","period":"Feb-23"},{"periodId":192054,"periodDate":"2023-03-31","period":"Mar-23"},{"periodId":192053,"periodDate":"2023-04-30","period":"Apr-23"},{"periodId":243631,"periodDate":"2023-05-31","period":"May-23"},{"periodId":243632,"periodDate":"2023-06-30","period":"Jun-23"},{"periodId":256641,"periodDate":"2023-07-31","period":"Jul-23"},{"periodId":256642,"periodDate":"2023-08-31","period":"Aug-23"},{"periodId":256643,"periodDate":"2023-09-30","period":"Sep-23"},{"periodId":256644,"periodDate":"2023-10-31","period":"Oct-23"},{"periodId":256645,"periodDate":"2023-11-30","period":"Nov-23"},{"periodId":256646,"periodDate":"2023-12-31","period":"Dec-23"}]}