{"series":[{"values":[null,null,null,null,null,null,null,null,null,null,null,null,null,null,null,null,null,null,null,null,null,null,null,null,null,null],"name":"Actual","seriesDataTypeId":4},{"values":[null,null,null,null,null,null,null,null,null,null,null,null,null,null,null,null,null,null,null,null,null,null,null,null,null,null],"name":"Target","seriesDataTypeId":4},{"values":[null,10,10,10,35,35,35,60,60,60,75,75,75,null,null,null,null,null,null,null,null,null,null,null,null,null],"name":"Percent Complete","seriesDataTypeId":6},{"values":[5,12,18,24,30,37,43,49,56,62,68,75,81,88,94,100,100,100,100,100,100,100,100,100,100,100],"name":"Calculated Percent Complete","seriesDataTypeId":6}],"concept":"scorecard-185055/initiatives/initiative-753457","periodicity":"Quarterly","periods":[{"periodId":385641,"periodDate":"2025-11-30","period":"Nov-25"},{"periodId":385640,"periodDate":"2025-12-31","period":"Dec-25"},{"periodId":385643,"periodDate":"2026-01-31","period":"Jan-26"},{"periodId":385644,"periodDate":"2026-02-28","period":"Feb-26"},{"periodId":385646,"periodDate":"2026-03-31","period":"Mar-26"},{"periodId":385645,"periodDate":"2026-04-30","period":"Apr-26"},{"periodId":385647,"periodDate":"2026-05-31","period":"May-26"},{"periodId":385648,"periodDate":"2026-06-30","period":"Jun-26"},{"periodId":385649,"periodDate":"2026-07-31","period":"Jul-26"},{"periodId":385650,"periodDate":"2026-08-31","period":"Aug-26"},{"periodId":385651,"periodDate":"2026-09-30","period":"Sep-26"},{"periodId":385652,"periodDate":"2026-10-31","period":"Oct-26"},{"periodId":385653,"periodDate":"2026-11-30","period":"Nov-26"},{"periodId":385654,"periodDate":"2026-12-31","period":"Dec-26"},{"periodId":385655,"periodDate":"2027-01-31","period":"Jan-27"},{"periodId":385656,"periodDate":"2027-02-28","period":"Feb-27"},{"periodId":385657,"periodDate":"2027-03-31","period":"Mar-27"},{"periodId":385658,"periodDate":"2027-04-30","period":"Apr-27"},{"periodId":385659,"periodDate":"2027-05-31","period":"May-27"},{"periodId":385660,"periodDate":"2027-06-30","period":"Jun-27"},{"periodId":385661,"periodDate":"2027-07-31","period":"Jul-27"},{"periodId":385662,"periodDate":"2027-08-31","period":"Aug-27"},{"periodId":385663,"periodDate":"2027-09-30","period":"Sep-27"},{"periodId":385664,"periodDate":"2027-10-31","period":"Oct-27"},{"periodId":385665,"periodDate":"2027-11-30","period":"Nov-27"},{"periodId":385666,"periodDate":"2027-12-31","period":"Dec-27"}]}