{"series":[{"values":[82,78,72.4,81.6,88.3,96.1,99.2,104.3,102.1,null],"name":"Actual","seriesDataTypeId":6},{"values":[100,100,100,100,100,100,100,100,100,100],"name":"Target","seriesDataTypeId":6},{"values":[null,null,64.2,73.8,80.1,88.4,92.6,98.7,99.2,null],"name":"New Construction %","seriesDataTypeId":6},{"values":[null,null,81.5,88.2,95.4,101.2,104.8,110.5,108.1,null],"name":"Rehabilitation %","seriesDataTypeId":6},{"values":[null,null,76.9,84.1,92.7,99.6,102.1,108.2,105.4,null],"name":"Preservation %","seriesDataTypeId":6}],"concept":"scorecard-185052/measures/measure-2127162","periodicity":"Quarterly","periods":[{"periodId":385627,"periodDate":"2024-09-30","period":"Sep-24"},{"periodId":385632,"periodDate":"2024-12-31","period":"Dec-24"},{"periodId":385634,"periodDate":"2025-03-31","period":"Mar-25"},{"periodId":385635,"periodDate":"2025-06-30","period":"Jun-25"},{"periodId":385637,"periodDate":"2025-09-30","period":"Sep-25"},{"periodId":385640,"periodDate":"2025-12-31","period":"Dec-25"},{"periodId":385646,"periodDate":"2026-03-31","period":"Mar-26"},{"periodId":385648,"periodDate":"2026-06-30","period":"Jun-26"},{"periodId":385651,"periodDate":"2026-09-30","period":"Sep-26"},{"periodId":385654,"periodDate":"2026-12-31","period":"Dec-26"}]}