{"series":[{"values":[0,0,0,0,0,0,0,0,0,0,0,0,0,0,0,0,0,0,0,0,0,0,0,0,0,0,0,0,0,0,0,0,0,0,0,0,0,0,0,0,0,0,0,0,0,0,0,0],"name":"No Information","seriesDataTypeId":9},{"values":[0,0,0,0,0,0,0,0,1,1,1,1,1,1,2,2,2,1,1,1,2,2,2,2,2,2,3,3,3,3,3,3,5,5,5,0,0,0,0,0,0,0,0,0,0,0,0,0],"name":"Below Plan","seriesDataTypeId":9},{"values":[0,0,0,0,0,0,0,0,3,3,3,3,3,3,2,2,2,3,3,3,2,2,2,2,2,2,1,1,1,3,3,3,1,1,1,0,0,0,0,0,0,0,0,0,0,0,0,0],"name":"Caution","seriesDataTypeId":9},{"values":[0,0,0,0,0,0,0,0,6,6,6,6,6,6,6,6,6,6,6,6,6,6,6,7,7,7,7,7,7,5,5,5,5,5,5,0,0,0,0,0,0,0,0,0,0,0,0,0],"name":"On Target","seriesDataTypeId":9}],"concept":"scorecard-185052/measures/measure-2138610","periodicity":"Quarterly","periods":[{"periodId":385621,"periodDate":"2024-01-31","period":"Jan-24"},{"periodId":385622,"periodDate":"2024-02-29","period":"Feb-24"},{"periodId":385623,"periodDate":"2024-03-31","period":"Mar-24"},{"periodId":385617,"periodDate":"2024-04-30","period":"Apr-24"},{"periodId":385626,"periodDate":"2024-05-31","period":"May-24"},{"periodId":385624,"periodDate":"2024-06-30","period":"Jun-24"},{"periodId":385625,"periodDate":"2024-07-31","period":"Jul-24"},{"periodId":385628,"periodDate":"2024-08-31","period":"Aug-24"},{"periodId":385627,"periodDate":"2024-09-30","period":"Sep-24"},{"periodId":385629,"periodDate":"2024-10-31","period":"Oct-24"},{"periodId":385630,"periodDate":"2024-11-30","period":"Nov-24"},{"periodId":385632,"periodDate":"2024-12-31","period":"Dec-24"},{"periodId":385631,"periodDate":"2025-01-31","period":"Jan-25"},{"periodId":385633,"periodDate":"2025-02-28","period":"Feb-25"},{"periodId":385634,"periodDate":"2025-03-31","period":"Mar-25"},{"periodId":385618,"periodDate":"2025-04-30","period":"Apr-25"},{"periodId":385638,"periodDate":"2025-05-31","period":"May-25"},{"periodId":385635,"periodDate":"2025-06-30","period":"Jun-25"},{"periodId":385636,"periodDate":"2025-07-31","period":"Jul-25"},{"periodId":385642,"periodDate":"2025-08-31","period":"Aug-25"},{"periodId":385637,"periodDate":"2025-09-30","period":"Sep-25"},{"periodId":385639,"periodDate":"2025-10-31","period":"Oct-25"},{"periodId":385641,"periodDate":"2025-11-30","period":"Nov-25"},{"periodId":385640,"periodDate":"2025-12-31","period":"Dec-25"},{"periodId":385643,"periodDate":"2026-01-31","period":"Jan-26"},{"periodId":385644,"periodDate":"2026-02-28","period":"Feb-26"},{"periodId":385646,"periodDate":"2026-03-31","period":"Mar-26"},{"periodId":385645,"periodDate":"2026-04-30","period":"Apr-26"},{"periodId":385647,"periodDate":"2026-05-31","period":"May-26"},{"periodId":385648,"periodDate":"2026-06-30","period":"Jun-26"},{"periodId":385649,"periodDate":"2026-07-31","period":"Jul-26"},{"periodId":385650,"periodDate":"2026-08-31","period":"Aug-26"},{"periodId":385651,"periodDate":"2026-09-30","period":"Sep-26"},{"periodId":385652,"periodDate":"2026-10-31","period":"Oct-26"},{"periodId":385653,"periodDate":"2026-11-30","period":"Nov-26"},{"periodId":385654,"periodDate":"2026-12-31","period":"Dec-26"},{"periodId":385655,"periodDate":"2027-01-31","period":"Jan-27"},{"periodId":385656,"periodDate":"2027-02-28","period":"Feb-27"},{"periodId":385657,"periodDate":"2027-03-31","period":"Mar-27"},{"periodId":385658,"periodDate":"2027-04-30","period":"Apr-27"},{"periodId":385659,"periodDate":"2027-05-31","period":"May-27"},{"periodId":385660,"periodDate":"2027-06-30","period":"Jun-27"},{"periodId":385661,"periodDate":"2027-07-31","period":"Jul-27"},{"periodId":385662,"periodDate":"2027-08-31","period":"Aug-27"},{"periodId":385663,"periodDate":"2027-09-30","period":"Sep-27"},{"periodId":385664,"periodDate":"2027-10-31","period":"Oct-27"},{"periodId":385665,"periodDate":"2027-11-30","period":"Nov-27"},{"periodId":385666,"periodDate":"2027-12-31","period":"Dec-27"}]}