{"series":[{"values":[5,5,5,5],"name":"Impact","seriesDataTypeId":9},{"values":[3,3,3,3],"name":"Probability","seriesDataTypeId":9},{"values":[15,15,15,15],"name":"Risk Rating","seriesDataTypeId":9}],"concept":"scorecard-185052/risks/risk-99860","periodicity":"Quarterly","periods":[{"periodId":385640,"periodDate":"2025-12-31","period":"Dec-25"},{"periodId":385646,"periodDate":"2026-03-31","period":"Mar-26"},{"periodId":385648,"periodDate":"2026-06-30","period":"Jun-26"},{"periodId":385651,"periodDate":"2026-09-30","period":"Sep-26"}]}