{"series":[{"values":[1650,2100,2480],"name":"Actual","seriesDataTypeId":5},{"values":[null,null,null],"name":"Target","seriesDataTypeId":5}],"concept":"scorecard-186333/measures/measure-2163777","periodicity":"Quarterly","periods":[{"periodId":385646,"periodDate":"2026-03-31","period":"Mar-26"},{"periodId":385648,"periodDate":"2026-06-30","period":"Jun-26"},{"periodId":385651,"periodDate":"2026-09-30","period":"Sep-26"}]}