{"series":[{"values":[2315,2812,2034,2430,2600,2604,2740,2812,2860,2034,2231,2234,2260,2290,2315,2430,2600,2604,2740,2812,2860,2900,2930,2968,3115,3367,3441,3525,null,null,null,null],"name":"Actual","seriesDataTypeId":4},{"values":[2388.1,2768.47,2060,2459.75,2533.54,2609.55,2687.83,2768.47,2000,2060,2121.8,2185.45,2251.02,2318.55,2388.1,2459.75,2533.54,2609.55,2687.83,2768.47,2851.52,2937.07,3025.18,3115.93,3209.41,3305.7,3404.87,3507.01,3612.22,3720.59,3832.21,3947.17],"name":"Target","seriesDataTypeId":4},{"values":[-73.1,43.53,-26,-29.75,66.46,-5.55,52.17,43.53,860,-26,109.2,48.55,8.98,-28.55,-73.1,-29.75,66.46,-5.55,52.17,43.53,8.48,-37.07,-95.18,-147.93,-94.41,61.3,36.13,17.99,null,null,null,null],"name":"Variance","seriesDataTypeId":4},{"values":[96.93898915,101.5723,98.73786408,98.79052749,102.62320705,99.78731965,101.94097097,101.57234863,143,98.73786408,105.14657366,102.22151044,100.39893026,98.76862694,96.93898915,98.79052749,102.62320705,99.78731965,101.94097097,101.57234863,100.29738525,98.7378578,96.85374093,95.25246074,97.05833783,101.85437275,101.06112715,100.51297259,null,null,null,null],"name":"Actual as % of Target","seriesDataTypeId":6}],"concept":"scorecard-149812/measures/measure-1426529","periodicity":"Monthly","periods":[{"periodId":33176,"periodDate":"2019-11-30","period":"Nov-19"},{"periodId":18786,"periodDate":"2019-12-31","period":"Dec-19"},{"periodId":33171,"periodDate":"2020-06-30","period":"Jun-20"},{"periodId":33177,"periodDate":"2020-12-31","period":"Dec-20"},{"periodId":33178,"periodDate":"2021-01-31","period":"Jan-21"},{"periodId":33179,"periodDate":"2021-02-28","period":"Feb-21"},{"periodId":33180,"periodDate":"2021-03-31","period":"Mar-21"},{"periodId":18799,"periodDate":"2021-04-30","period":"Apr-21"},{"periodId":168152,"periodDate":"2021-05-31","period":"May-21"},{"periodId":168150,"periodDate":"2021-06-30","period":"Jun-21"},{"periodId":168151,"periodDate":"2021-07-31","period":"Jul-21"},{"periodId":168154,"periodDate":"2021-08-31","period":"Aug-21"},{"periodId":168153,"periodDate":"2021-09-30","period":"Sep-21"},{"periodId":168155,"periodDate":"2021-10-31","period":"Oct-21"},{"periodId":168156,"periodDate":"2021-11-30","period":"Nov-21"},{"periodId":168158,"periodDate":"2021-12-31","period":"Dec-21"},{"periodId":168157,"periodDate":"2022-01-31","period":"Jan-22"},{"periodId":168159,"periodDate":"2022-02-28","period":"Feb-22"},{"periodId":168160,"periodDate":"2022-03-31","period":"Mar-22"},{"periodId":18800,"periodDate":"2022-04-30","period":"Apr-22"},{"periodId":192046,"periodDate":"2022-05-31","period":"May-22"},{"periodId":192043,"periodDate":"2022-06-30","period":"Jun-22"},{"periodId":192044,"periodDate":"2022-07-31","period":"Jul-22"},{"periodId":192050,"periodDate":"2022-08-31","period":"Aug-22"},{"periodId":192045,"periodDate":"2022-09-30","period":"Sep-22"},{"periodId":192047,"periodDate":"2022-10-31","period":"Oct-22"},{"periodId":192049,"periodDate":"2022-11-30","period":"Nov-22"},{"periodId":192048,"periodDate":"2022-12-31","period":"Dec-22"},{"periodId":192051,"periodDate":"2023-01-31","period":"Jan-23"},{"periodId":192052,"periodDate":"2023-02-28","period":"Feb-23"},{"periodId":192054,"periodDate":"2023-03-31","period":"Mar-23"},{"periodId":192053,"periodDate":"2023-04-30","period":"Apr-23"}]}