{"series":[{"values":[85,80,87,75,88,80,null],"name":"Actual","seriesDataTypeId":6},{"values":[80,80,80,80,80,80,80],"name":"Target","seriesDataTypeId":6}],"concept":"scorecard-149813/measures/measure-1426547","periodicity":"Annual","periods":[{"periodId":18786,"periodDate":"2019-12-31","period":"Dec-19"},{"periodId":33177,"periodDate":"2020-12-31","period":"Dec-20"},{"periodId":18799,"periodDate":"2021-04-30","period":"Apr-21"},{"periodId":168158,"periodDate":"2021-12-31","period":"Dec-21"},{"periodId":18800,"periodDate":"2022-04-30","period":"Apr-22"},{"periodId":192048,"periodDate":"2022-12-31","period":"Dec-22"},{"periodId":192053,"periodDate":"2023-04-30","period":"Apr-23"}]}