{"series":[{"values":[8500000,null,null,8500000,null,null,8500000,null,null,8500000,null,null,8500000,null,null,8500000,null,null,8500000],"name":"Total Budget","seriesDataTypeId":10},{"values":[193000,null,null,737000,null,null,1554000,null,null,2542000,null,null,3655000,null,null,4820000,null,null,5947000],"name":"Planned Spend (Cumulative)","seriesDataTypeId":10},{"values":[192000,null,null,729000,null,null,1530000,null,null,2491000,null,null,3564000,null,null,4675000,null,null,null],"name":"Actual Spend (Cumulative)","seriesDataTypeId":10},{"values":[8480000,null,null,8470000,null,null,8450000,null,null,8430000,null,null,8420000,null,null,8400000,null,null,8400000],"name":"Forecast at Completion","seriesDataTypeId":10},{"values":[1000,null,null,8000,null,null,24000,null,null,51000,null,null,91000,null,null,145000,null,null,null],"name":"Budget Variance","seriesDataTypeId":10},{"values":[2.3,null,null,8.6,null,null,18,null,null,29.3,null,null,41.9,null,null,55,null,null,null],"name":"% of Budget Spent","seriesDataTypeId":10},{"values":[6,null,null,10,null,null,17,null,null,26,null,null,38,null,null,55,null,null,69],"name":"Planned % Complete","seriesDataTypeId":10},{"values":[5,5,5,10,10,10,15,15,15,25,25,25,40,40,40,55,55,55,null],"name":"Actual % Complete","seriesDataTypeId":10},{"values":[-1,null,null,0,null,null,-2,null,null,-1,null,null,2,null,null,0,null,null,null],"name":"Schedule Variance (pts)","seriesDataTypeId":5}],"concept":"scorecard-185052/initiatives/initiative-753443","periodicity":"Quarterly","periods":[{"periodId":385635,"periodDate":"2025-06-30","period":"Jun-25"},{"periodId":385636,"periodDate":"2025-07-31","period":"Jul-25"},{"periodId":385642,"periodDate":"2025-08-31","period":"Aug-25"},{"periodId":385637,"periodDate":"2025-09-30","period":"Sep-25"},{"periodId":385639,"periodDate":"2025-10-31","period":"Oct-25"},{"periodId":385641,"periodDate":"2025-11-30","period":"Nov-25"},{"periodId":385640,"periodDate":"2025-12-31","period":"Dec-25"},{"periodId":385643,"periodDate":"2026-01-31","period":"Jan-26"},{"periodId":385644,"periodDate":"2026-02-28","period":"Feb-26"},{"periodId":385646,"periodDate":"2026-03-31","period":"Mar-26"},{"periodId":385645,"periodDate":"2026-04-30","period":"Apr-26"},{"periodId":385647,"periodDate":"2026-05-31","period":"May-26"},{"periodId":385648,"periodDate":"2026-06-30","period":"Jun-26"},{"periodId":385649,"periodDate":"2026-07-31","period":"Jul-26"},{"periodId":385650,"periodDate":"2026-08-31","period":"Aug-26"},{"periodId":385651,"periodDate":"2026-09-30","period":"Sep-26"},{"periodId":385652,"periodDate":"2026-10-31","period":"Oct-26"},{"periodId":385653,"periodDate":"2026-11-30","period":"Nov-26"},{"periodId":385654,"periodDate":"2026-12-31","period":"Dec-26"}]}