{"series":[{"values":[42.7,37.4,39,40.7,37.4,34,34.5,35.9,37.3],"name":"Actual","seriesDataTypeId":6},{"values":[40,40,40,40,40,40,40,40,40],"name":"Target","seriesDataTypeId":6}],"concept":"scorecard-185055/measures/measure-2127184","periodicity":"Quarterly","periods":[{"periodId":385627,"periodDate":"2024-09-30","period":"Sep-24"},{"periodId":385632,"periodDate":"2024-12-31","period":"Dec-24"},{"periodId":385634,"periodDate":"2025-03-31","period":"Mar-25"},{"periodId":385635,"periodDate":"2025-06-30","period":"Jun-25"},{"periodId":385637,"periodDate":"2025-09-30","period":"Sep-25"},{"periodId":385640,"periodDate":"2025-12-31","period":"Dec-25"},{"periodId":385646,"periodDate":"2026-03-31","period":"Mar-26"},{"periodId":385648,"periodDate":"2026-06-30","period":"Jun-26"},{"periodId":385651,"periodDate":"2026-09-30","period":"Sep-26"}]}