{"series":[{"values":[null,null,null,null,null,null,null,null,null,null,null,null,null,null,null,50000,50000,50000,50000,50000,50000,50000,50000,50000,50000,50000,50000],"name":"Design Costs To Date","seriesDataTypeId":4},{"values":[null,null,null,null,null,null,null,null,null,null,null,null,null,null,null,443020,490000,530912,598186,620948,650981,689234,710985,740943,790875,812354,910000],"name":"Construction Costs To Date","seriesDataTypeId":4},{"values":[null,null,null,null,null,null,null,null,null,null,null,null,null,null,null,493020,540000,580912,648186,670948,700981,739234,760985,790943,840875,862354,960000],"name":"Total Spending To Date","seriesDataTypeId":4},{"values":[null,null,null,null,null,null,null,null,null,null,null,null,null,null,null,1000000,1000000,1000000,1000000,1000000,1000000,1000000,1000000,1000000,1000000,1000000,1000000],"name":"Project Budget","seriesDataTypeId":4},{"values":[40,40,40,40,40,40,40,40,40,40,40,40,40,40,40,40,43,50,55,60,65,65,74,80,86,88,94],"name":"Actual % Complete","seriesDataTypeId":6},{"values":[null,null,null,null,null,null,null,null,null,null,null,null,null,null,null,40,45,50,55,60,65,70,75,80,85,90,94],"name":"Planned % Complete","seriesDataTypeId":6},{"values":[null,null,null,null,null,null,null,null,null,null,null,null,null,null,null,400000,430000,500000,550000,600000,650000,650000,740000,800000,860000,880000,940000],"name":"Budget based on % complete","seriesDataTypeId":4},{"values":[null,null,null,null,null,null,null,null,null,null,null,null,null,null,null,93020,110000,80912,98186,70948,50981,89234,20985,-9057,-19125,-17646,20000],"name":"Variance from Target","seriesDataTypeId":4},{"values":[null,null,null,null,null,null,null,null,null,null,null,null,null,null,null,23.255,25.58139535,16.1824,17.852,11.82466667,7.84323077,13.72830769,2.83581081,-1.132125,-2.22383721,-2.00522727,2.12765957],"name":"% Variance","seriesDataTypeId":6}],"concept":"scorecard-77146/initiatives/initiative-308980","periodicity":"Monthly 2025-26","periods":[{"periodId":149093,"periodDate":"2022-12-31","period":"Dec-22"},{"periodId":168164,"periodDate":"2023-06-30","period":"Jun-23"},{"periodId":168168,"periodDate":"2023-12-31","period":"Dec-23"},{"periodId":168170,"periodDate":"2024-01-31","period":"Jan-24"},{"periodId":168173,"periodDate":"2024-02-29","period":"Feb-24"},{"periodId":168172,"periodDate":"2024-03-31","period":"Mar-24"},{"periodId":149074,"periodDate":"2024-04-30","period":"Apr-24"},{"periodId":189837,"periodDate":"2024-05-31","period":"May-24"},{"periodId":189836,"periodDate":"2024-06-30","period":"Jun-24"},{"periodId":189839,"periodDate":"2024-07-31","period":"Jul-24"},{"periodId":189838,"periodDate":"2024-08-31","period":"Aug-24"},{"periodId":189840,"periodDate":"2024-09-30","period":"Sep-24"},{"periodId":189845,"periodDate":"2024-10-31","period":"Oct-24"},{"periodId":189841,"periodDate":"2024-11-30","period":"Nov-24"},{"periodId":256354,"periodDate":"2024-12-31","period":"Dec-24"},{"periodId":189842,"periodDate":"2025-01-31","period":"Jan-25"},{"periodId":189844,"periodDate":"2025-02-28","period":"Feb-25"},{"periodId":189843,"periodDate":"2025-03-31","period":"Mar-25"},{"periodId":168171,"periodDate":"2025-04-30","period":"Apr-25"},{"periodId":256347,"periodDate":"2025-05-31","period":"May-25"},{"periodId":256348,"periodDate":"2025-06-30","period":"Jun-25"},{"periodId":256349,"periodDate":"2025-07-31","period":"Jul-25"},{"periodId":256350,"periodDate":"2025-08-31","period":"Aug-25"},{"periodId":256351,"periodDate":"2025-09-30","period":"Sep-25"},{"periodId":256352,"periodDate":"2025-10-31","period":"Oct-25"},{"periodId":256353,"periodDate":"2025-11-30","period":"Nov-25"},{"periodId":189846,"periodDate":"2025-12-31","period":"Dec-25"}]}