{"series":[{"values":[17.54068716,12.53241141,14.11911703,15.72016461,9.67032967,7.05263158,4.54545455,11.7,13.34002006,9.04761905,4.27927928,4.16666667,6.72131148,9.6,13.75404531,5.45454545,1.01694915,-0.06664445,-13.24884793,8.85714286,6.85314685,-3.79825654,4.37828371,null,null,null,null,null,null,null,null,null,null,null,null],"name":"Metropolis - Actual","seriesDataTypeId":6},{"values":[5.26315789,5.26315789,5.26315789,5.26315789,5.26315789,5.26315789,5.26315789,5.26315789,5.26315789,5.26315789,5.26315789,5.26315789,5.26315789,5.26315789,5.26315789,5.26315789,5.26315789,5.26315789,5.26315789,5.26315789,5.26315789,5.26315789,5.26315789,5.26315789,5.26315789,5.26315789,5.26315789,5.26315789,5.26315789,5.26315789,5.26315789,5.26315789,5.26315789,5.26315789,5.26315789],"name":"Metropolis - Target","seriesDataTypeId":6}],"concept":"scorecard-7631/measures/measure-1408245","periodicity":"Default","periods":[{"periodId":33178,"periodDate":"2021-01-31","period":"Jan-21"},{"periodId":33179,"periodDate":"2021-02-28","period":"Feb-21"},{"periodId":33180,"periodDate":"2021-03-31","period":"Mar-21"},{"periodId":18799,"periodDate":"2021-04-30","period":"Apr-21"},{"periodId":168152,"periodDate":"2021-05-31","period":"May-21"},{"periodId":168150,"periodDate":"2021-06-30","period":"Jun-21"},{"periodId":168151,"periodDate":"2021-07-31","period":"Jul-21"},{"periodId":168154,"periodDate":"2021-08-31","period":"Aug-21"},{"periodId":168153,"periodDate":"2021-09-30","period":"Sep-21"},{"periodId":168155,"periodDate":"2021-10-31","period":"Oct-21"},{"periodId":168156,"periodDate":"2021-11-30","period":"Nov-21"},{"periodId":168157,"periodDate":"2022-01-31","period":"Jan-22"},{"periodId":168159,"periodDate":"2022-02-28","period":"Feb-22"},{"periodId":168160,"periodDate":"2022-03-31","period":"Mar-22"},{"periodId":18800,"periodDate":"2022-04-30","period":"Apr-22"},{"periodId":192046,"periodDate":"2022-05-31","period":"May-22"},{"periodId":192043,"periodDate":"2022-06-30","period":"Jun-22"},{"periodId":192044,"periodDate":"2022-07-31","period":"Jul-22"},{"periodId":192050,"periodDate":"2022-08-31","period":"Aug-22"},{"periodId":192045,"periodDate":"2022-09-30","period":"Sep-22"},{"periodId":192047,"periodDate":"2022-10-31","period":"Oct-22"},{"periodId":192049,"periodDate":"2022-11-30","period":"Nov-22"},{"periodId":192048,"periodDate":"2022-12-31","period":"Dec-22"},{"periodId":192051,"periodDate":"2023-01-31","period":"Jan-23"},{"periodId":192052,"periodDate":"2023-02-28","period":"Feb-23"},{"periodId":192054,"periodDate":"2023-03-31","period":"Mar-23"},{"periodId":192053,"periodDate":"2023-04-30","period":"Apr-23"},{"periodId":243631,"periodDate":"2023-05-31","period":"May-23"},{"periodId":243632,"periodDate":"2023-06-30","period":"Jun-23"},{"periodId":256641,"periodDate":"2023-07-31","period":"Jul-23"},{"periodId":256642,"periodDate":"2023-08-31","period":"Aug-23"},{"periodId":256643,"periodDate":"2023-09-30","period":"Sep-23"},{"periodId":256644,"periodDate":"2023-10-31","period":"Oct-23"},{"periodId":256645,"periodDate":"2023-11-30","period":"Nov-23"},{"periodId":256646,"periodDate":"2023-12-31","period":"Dec-23"}]}