{"series":[{"values":[2100000],"name":"Actual Budget","seriesDataTypeId":4},{"values":[2045300],"name":"Expenditure","seriesDataTypeId":4},{"values":[97.3952381],"name":"% of Budget Expended","seriesDataTypeId":5}],"concept":"scorecard-185309/initiatives/initiative-747577","periodicity":"Quarterly","periods":[{"periodId":385648,"periodDate":"2026-06-30","period":"Jun-26"}]}