{"series":[{"values":[15,20,16,null,null,12],"name":"Actual","seriesDataTypeId":9},{"values":[18,18,15,18,15,18],"name":"Target","seriesDataTypeId":9},{"values":[null,20,null,20,null,20],"name":"Baseline","seriesDataTypeId":9}],"concept":"scorecard-77149/measures/measure-542536","periodicity":"Annual","periods":[{"periodId":149093,"periodDate":"2022-12-31","period":"Dec-22"},{"periodId":168168,"periodDate":"2023-12-31","period":"Dec-23"},{"periodId":149074,"periodDate":"2024-04-30","period":"Apr-24"},{"periodId":256354,"periodDate":"2024-12-31","period":"Dec-24"},{"periodId":168171,"periodDate":"2025-04-30","period":"Apr-25"},{"periodId":189846,"periodDate":"2025-12-31","period":"Dec-25"}]}